case,rank,image_path,status,base_score,final_score_after_rerank,vila_score_raw,acut_short_reason,acut_detailed_reason,acut_comparison_reason,acut_rejection_reason
selected_top,1,test_samples/KakaoTalk_20260330_180646779_10.jpg,selected,0.583427,0.597029,0.332567,"Composition carried this frame into the A-cut, helped by aesthetic score.","Ranked #1 with a final score of 0.597, staying 0.082 above the cut line. The comparison was mostly won on composition-side evidence rather than raw score spread alone. KakaoTalk_20260330_180646779_08.jpg stayed closest in rank, yet composition and aesthetic score kept this frame ahead, although background cleanliness was weaker. VILA mostly backed the decision through composition, with lighting and background cleanliness still softer.","KakaoTalk_20260330_180646779_08.jpg stayed closest in rank, yet composition and aesthetic score kept this frame ahead, although background cleanliness was weaker.",
selected_top,2,test_samples/KakaoTalk_20260330_180646779_08.jpg,selected,0.529155,0.568042,0.388152,The selector held this frame on technical quality; background cleanliness and composition created the clearest edge.,"Ranked #2 with a final score of 0.568, staying 0.053 above the cut line. Technical quality was the selector's clearest lever here, and background cleanliness and composition created most of the separation. The selector leaned on technical quality (0.554 vs 0.513 aesthetic). Relative to KakaoTalk_20260330_180646779_07.jpg, the score edge was slightly higher by 0.011, driven mostly by background cleanliness and overall image appeal, although technical quality was weaker.","Relative to KakaoTalk_20260330_180646779_07.jpg, the score edge was slightly higher by 0.011, driven mostly by background cleanliness and overall image appeal, although technical quality was weaker. The nearby comparison with KakaoTalk_20260330_180646779_10.jpg tilted on background cleanliness and subject clarity, and the VILA score was higher by 0.056.",
selected_top,3,test_samples/KakaoTalk_20260330_180646779_07.jpg,selected,0.551174,0.557282,0.316095,The selector held this frame on technical quality; aesthetic score created the clearest edge.,"Ranked #3 with a final score of 0.557, staying 0.043 above the cut line. Technical quality was the selector's clearest lever here, and aesthetic score created most of the separation. The selector leaned on technical quality (0.592 vs 0.524 aesthetic). Relative to KakaoTalk_20260330_180646779_08.jpg, the score edge was slightly lower by 0.011, driven mostly by technical quality and aesthetic score, although background cleanliness was weaker.","Relative to KakaoTalk_20260330_180646779_08.jpg, the score edge was slightly lower by 0.011, driven mostly by technical quality and aesthetic score, although background cleanliness was weaker. The nearby comparison with KakaoTalk_20260330_180646779_11.jpg tilted on subject clarity and background cleanliness, and the VILA score was higher by 0.070.",
selected_top,4,test_samples/KakaoTalk_20260330_180646779_11.jpg,selected,0.54979,0.524098,0.246186,"This frame cleared the cut by a small edge, mostly through composition and aesthetic score.","Ranked #4 with a final score of 0.521, staying 0.006 above the cut line. The margin was slim, and composition and aesthetic score only just covered for weaker background cleanliness and subject clarity. KakaoTalk_20260330_180646779_06.jpg stayed closest in rank, yet composition and overall image appeal kept this frame ahead, although background cleanliness was weaker. VILA mostly backed the decision through composition, with lighting and subject clarity still softer.","KakaoTalk_20260330_180646779_06.jpg stayed closest in rank, yet composition and overall image appeal kept this frame ahead, although background cleanliness was weaker. Against KakaoTalk_20260330_180646779_07.jpg, the clearest edges were overall image appeal and technical quality, and the VILA score was lower by 0.070.",
selected_top,5,test_samples/KakaoTalk_20260330_180646779_06.jpg,selected,0.49326,0.518915,0.359063,It stayed in on a narrow margin because background cleanliness and subject clarity barely outweighed lighting and aesthetic score.,"Ranked #5 with a final score of 0.519, staying 0.004 above the cut line. It survived the cut line by holding a small edge on background cleanliness and subject clarity while lighting and aesthetic score stayed softer. Relative to KakaoTalk_20260330_180646779.jpg, the score edge was roughly tied (+0.004), driven mostly by background cleanliness and subject clarity, although overall image appeal was weaker. On the VILA side, background cleanliness supported the pick more than lighting and overall image quality hurt it.","Relative to KakaoTalk_20260330_180646779.jpg, the score edge was roughly tied (+0.004), driven mostly by background cleanliness and subject clarity, although overall image appeal was weaker. The nearby comparison with KakaoTalk_20260330_180646779_11.jpg tilted on background cleanliness and subject clarity, and the VILA score was higher by 0.113.",
near_cut_rejected,6,test_samples/KakaoTalk_20260330_180646779.jpg,rejected,0.514763,0.514736,0.302605,"It missed the A-cut mainly because background cleanliness and subject clarity trailed the selected set, even though lighting and aesthetic score remained acceptable.","Ranked #6 with a final score of 0.515, trailing the cut line by 0.004. The tradeoff broke against this frame once background cleanliness and subject clarity fell behind the cut-line alternatives. Against KakaoTalk_20260330_180646779_06.jpg, the final score was roughly tied (-0.004) and the main deficits were background cleanliness and subject clarity, although overall image appeal remained competitive. The prompt signals were mixed, but lighting and overall image quality remained the larger issue.","Against KakaoTalk_20260330_180646779_06.jpg, the final score was roughly tied (-0.004) and the main deficits were background cleanliness and subject clarity, although overall image appeal remained competitive. Against KakaoTalk_20260330_180646779_05.jpg, the weaker areas were background cleanliness and lighting, while the VILA score was lower by 0.050.","It missed the A-cut mainly because background cleanliness and subject clarity trailed the selected set, even though lighting and aesthetic score remained acceptable."
near_cut_rejected,7,test_samples/KakaoTalk_20260330_180646779_05.jpg,rejected,0.490297,0.490297,0.35227,"It missed the A-cut mainly because composition and subject clarity trailed the selected set, even though background cleanliness and lighting remained acceptable.","Ranked #7 with a final score of 0.490, trailing the cut line by 0.029. The tradeoff broke against this frame once composition and subject clarity fell behind the cut-line alternatives. Against KakaoTalk_20260330_180646779_12.jpg, the final score was roughly tied (+0.007) and the main deficits were composition and overall image appeal, although background cleanliness remained competitive. The prompt signals were mixed, but overall image quality and lighting remained the larger issue.","Against KakaoTalk_20260330_180646779_12.jpg, the final score was roughly tied (+0.007) and the main deficits were composition and overall image appeal, although background cleanliness remained competitive. The nearby comparison with KakaoTalk_20260330_180646779.jpg was lost on overall image appeal and technical quality, while the VILA score was higher by 0.050.","It missed the A-cut mainly because composition and subject clarity trailed the selected set, even though background cleanliness and lighting remained acceptable."
near_cut_rejected,8,test_samples/KakaoTalk_20260330_180646779_12.jpg,rejected,0.567433,0.583335,0.337625,"It missed the A-cut mainly because background cleanliness and lighting trailed the selected set, even though composition and subject clarity remained acceptable.","Ranked #8 with a final score of 0.483, trailing the cut line by 0.036. The tradeoff broke against this frame once background cleanliness and lighting fell behind the cut-line alternatives. KakaoTalk_20260330_180646779_05.jpg stayed ahead because background cleanliness and lighting were weaker here, although composition remained competitive. The prompt signals were mixed, but lighting and background cleanliness remained the larger issue.","KakaoTalk_20260330_180646779_05.jpg stayed ahead because background cleanliness and lighting were weaker here, although composition remained competitive. Against KakaoTalk_20260330_180646779_04.jpg, the weaker areas were background cleanliness and lighting, while the VILA score was higher by 0.066.","It missed the A-cut mainly because background cleanliness and lighting trailed the selected set, even though composition and subject clarity remained acceptable."
