case,rank,image_path,status,base_score,aesthetic_score,aesthetic_score_contributed,aesthetic_models_used,aesthetic_backend,final_score_after_rerank,vila_score_raw,acut_short_reason,acut_detailed_reason,acut_comparison_reason,explanation_source,acut_rejection_reason
selected_top,1,test_samples/KakaoTalk_20260330_180646779_10.jpg,selected,0.583427,0.567437,True,"[""composition_aadb"",""nima_ava"",""alamp_aadb"",""musiq_aadb"",""rgnet_aadb"",""pairwise_aadb""]",precomputed_scores,0.597029,0.332567,"Composition carried this frame into the A-cut, helped by technical quality.","Ranked #1 with a final score of 0.597, staying 0.040 above the cut line. The comparison was mostly won on composition-side evidence rather than raw score spread alone. KakaoTalk_20260330_180646779_12.jpg stayed closest in rank, yet composition and technical quality kept this frame ahead, although subject clarity was weaker. VILA mostly backed the decision through composition, with lighting and background cleanliness still softer.","KakaoTalk_20260330_180646779_12.jpg stayed closest in rank, yet composition and technical quality kept this frame ahead, although subject clarity was weaker.",baseline_acut,
selected_top,2,test_samples/KakaoTalk_20260330_180646779_12.jpg,selected,0.567433,0.559971,True,"[""composition_aadb"",""nima_ava"",""alamp_aadb"",""musiq_aadb"",""rgnet_aadb"",""pairwise_aadb""]",precomputed_scores,0.583335,0.337625,"A balanced score profile kept this frame above the cut, led by subject clarity and background cleanliness.","Ranked #2 with a final score of 0.583, staying 0.026 above the cut line. The selector did not rely on one spike; it held together through subject clarity and background cleanliness. The selector stayed balanced between aesthetic (0.560) and technical (0.579) components. KakaoTalk_20260330_180646779_10.jpg stayed closest in rank, yet subject clarity and background cleanliness kept this frame ahead, although composition was weaker.","KakaoTalk_20260330_180646779_10.jpg stayed closest in rank, yet subject clarity and background cleanliness kept this frame ahead, although composition was weaker. Against KakaoTalk_20260330_180646779_08.jpg, the clearest edges were composition and aesthetic score, and the VILA score was lower by 0.051.",baseline_acut,
selected_top,3,test_samples/KakaoTalk_20260330_180646779_08.jpg,selected,0.529155,0.512813,True,"[""composition_aadb"",""nima_ava"",""alamp_aadb"",""musiq_aadb"",""rgnet_aadb"",""pairwise_aadb""]",precomputed_scores,0.568042,0.388152,It stayed in on a narrow margin because background cleanliness and composition barely outweighed technical quality and aesthetic score.,"Ranked #3 with a final score of 0.568, staying 0.011 above the cut line. It survived the cut line by holding a small edge on background cleanliness and composition while technical quality and aesthetic score stayed softer. Relative to KakaoTalk_20260330_180646779_07.jpg, the score edge was slightly higher by 0.011, driven mostly by background cleanliness and overall image appeal, although technical quality was weaker. On the VILA side, composition supported the pick more than lighting and overall image quality hurt it.","Relative to KakaoTalk_20260330_180646779_07.jpg, the score edge was slightly higher by 0.011, driven mostly by background cleanliness and overall image appeal, although technical quality was weaker. The nearby comparison with KakaoTalk_20260330_180646779_12.jpg tilted on background cleanliness and overall image appeal, and the VILA score was higher by 0.051.",baseline_acut,
near_cut_rejected,4,test_samples/KakaoTalk_20260330_180646779_07.jpg,rejected,0.551174,0.524001,True,"[""composition_aadb"",""nima_ava"",""alamp_aadb"",""musiq_aadb"",""rgnet_aadb"",""pairwise_aadb""]",precomputed_scores,0.557282,0.316095,This frame fell below the cut when background cleanliness and composition outweighed technical quality and aesthetic score in nearby comparisons.,"Ranked #4 with a final score of 0.557, trailing the cut line by 0.011. It remained close in places, yet the loss concentrated on background cleanliness and composition. Against KakaoTalk_20260330_180646779_08.jpg, the final score was slightly lower by 0.011 and the main deficits were background cleanliness and overall image appeal, although technical quality remained competitive. Prompt-side evidence also slipped on lighting and overall image quality, although composition was not absent.","Against KakaoTalk_20260330_180646779_08.jpg, the final score was slightly lower by 0.011 and the main deficits were background cleanliness and overall image appeal, although technical quality remained competitive. The nearby comparison with KakaoTalk_20260330_180646779_11.jpg was lost on overall image appeal and technical quality, while the VILA score was higher by 0.070.",baseline_acut,This frame fell below the cut when background cleanliness and composition outweighed technical quality and aesthetic score in nearby comparisons.
near_cut_rejected,5,test_samples/KakaoTalk_20260330_180646779_11.jpg,rejected,0.54979,0.501151,True,"[""composition_aadb"",""nima_ava"",""alamp_aadb"",""musiq_aadb"",""rgnet_aadb"",""pairwise_aadb""]",precomputed_scores,0.524098,0.246186,This frame fell below the cut when background cleanliness and subject clarity outweighed composition and aesthetic score in nearby comparisons.,"Ranked #5 with a final score of 0.524, trailing the cut line by 0.044. It remained close in places, yet the loss concentrated on background cleanliness and subject clarity. KakaoTalk_20260330_180646779_06.jpg stayed ahead because background cleanliness and subject clarity were weaker here, although composition remained competitive. Prompt-side evidence also slipped on lighting and subject clarity, although composition was not absent.","KakaoTalk_20260330_180646779_06.jpg stayed ahead because background cleanliness and subject clarity were weaker here, although composition remained competitive. Against KakaoTalk_20260330_180646779_07.jpg, the weaker areas were subject clarity and background cleanliness, while the VILA score was lower by 0.070.",baseline_acut,This frame fell below the cut when background cleanliness and subject clarity outweighed composition and aesthetic score in nearby comparisons.
near_cut_rejected,6,test_samples/KakaoTalk_20260330_180646779_06.jpg,rejected,0.49326,0.441072,True,"[""composition_aadb"",""nima_ava"",""alamp_aadb"",""musiq_aadb"",""rgnet_aadb"",""pairwise_aadb""]",precomputed_scores,0.518915,0.359063,"It missed the A-cut mainly because lighting and aesthetic score trailed the selected set, even though background cleanliness and subject clarity remained acceptable.","Ranked #6 with a final score of 0.519, trailing the cut line by 0.049. The tradeoff broke against this frame once lighting and aesthetic score fell behind the cut-line alternatives. Against KakaoTalk_20260330_180646779.jpg, the final score was roughly tied (+0.004) and the main deficits were overall image appeal and lighting, although background cleanliness remained competitive. The prompt signals were mixed, but lighting and overall image quality remained the larger issue.","Against KakaoTalk_20260330_180646779.jpg, the final score was roughly tied (+0.004) and the main deficits were overall image appeal and lighting, although background cleanliness remained competitive. The nearby comparison with KakaoTalk_20260330_180646779_11.jpg was lost on composition and overall image appeal, while the VILA score was higher by 0.113.",baseline_acut,"It missed the A-cut mainly because lighting and aesthetic score trailed the selected set, even though background cleanliness and subject clarity remained acceptable."
